{
  "$schema": "../../tools/schemas/recipe.schema.json",
  "id": "01-media-librarian",
  "number": 1,
  "title": "Read-Only Media Librarian",
  "summary": "The reference filesystem MCP server pointed at a media tree, mounted read-only, with no network.",
  "status": "works-ootb",
  "transport": "stdio",
  "chapter": "Chapter 4, Recipe 1",
  "tags": [
    "filesystem",
    "media",
    "read-only"
  ],
  "upstream": {
    "description": "Reference filesystem MCP server (modelcontextprotocol/servers)",
    "image": "mcp/filesystem:vX.Y.Z",
    "repository": "https://github.com/modelcontextprotocol/servers/tree/main/src/filesystem"
  },
  "environmentVariables": [
    {
      "name": "MEDIA_DIR",
      "description": "Directory on the Docker host to expose read-only as /media.",
      "isRequired": false,
      "isSecret": false,
      "placeholder": "/tank/media"
    }
  ],
  "firstQuestion": "What's the largest file in my media folder and did anything land there this week?",
  "scopeNotes": [
    ":ro mount: the server physically cannot write.",
    "network_mode: none: nothing to phone home to."
  ]
}
